{
  "id": "menagery",
  "display_name": "Menagery",
  "subtitle": "Woodland catalog, rolling hills, ramp bluffs and cave demo",
  "seed": 1407,
  "bounds": [
    -38,
    -40,
    20,
    14
  ],
  "spawn": [
    16,
    0
  ],
  "sea": false,
  "terrain_regions": [
    {
      "rect": [
        -19,
        -13,
        19,
        26
      ],
      "kind": "path"
    },
    {
      "rect": [
        1,
        -1,
        19,
        2
      ],
      "kind": "path"
    },
    {
      "rect": [
        4,
        -7,
        12,
        14
      ],
      "kind": "sand"
    },
    {
      "rect": [
        15,
        -14,
        2,
        13
      ],
      "kind": "cobble"
    },
    {
      "rect": [
        -2,
        -39,
        2,
        26
      ],
      "kind": "path"
    },
    {
      "rect": [
        -17,
        -28,
        35,
        2
      ],
      "kind": "path"
    },
    {
      "rect": [
        11,
        -35,
        6,
        4
      ],
      "kind": "path"
    }
  ],
  "props": [
    {
      "id": "feature_1a",
      "kind": "catalog_feature",
      "at": [
        -16,
        -10
      ],
      "catalog_code": "1A"
    },
    {
      "id": "feature_2a",
      "kind": "catalog_feature",
      "at": [
        -11,
        -10
      ],
      "catalog_code": "2A"
    },
    {
      "id": "feature_3a",
      "kind": "catalog_feature",
      "at": [
        -6,
        -10
      ],
      "catalog_code": "3A"
    },
    {
      "id": "feature_4a",
      "kind": "catalog_feature",
      "at": [
        -1,
        -10
      ],
      "catalog_code": "4A"
    },
    {
      "id": "feature_1b",
      "kind": "catalog_feature",
      "at": [
        -16,
        -6
      ],
      "catalog_code": "1B"
    },
    {
      "id": "feature_2b",
      "kind": "catalog_feature",
      "at": [
        -11,
        -6
      ],
      "catalog_code": "2B"
    },
    {
      "id": "feature_3b",
      "kind": "catalog_feature",
      "at": [
        -6,
        -6
      ],
      "catalog_code": "3B"
    },
    {
      "id": "feature_4b",
      "kind": "catalog_feature",
      "at": [
        -1,
        -6
      ],
      "catalog_code": "4B"
    },
    {
      "id": "feature_5b",
      "kind": "catalog_feature",
      "at": [
        -16,
        -2
      ],
      "catalog_code": "5B"
    },
    {
      "id": "feature_1c",
      "kind": "catalog_feature",
      "at": [
        -11,
        -2
      ],
      "catalog_code": "1C"
    },
    {
      "id": "feature_2c",
      "kind": "catalog_feature",
      "at": [
        -6,
        -2
      ],
      "catalog_code": "2C"
    },
    {
      "id": "feature_3c",
      "kind": "catalog_feature",
      "at": [
        -1,
        -2
      ],
      "catalog_code": "3C"
    },
    {
      "id": "feature_4c",
      "kind": "catalog_feature",
      "at": [
        -16,
        2
      ],
      "catalog_code": "4C"
    },
    {
      "id": "feature_5c",
      "kind": "catalog_feature",
      "at": [
        -11,
        2
      ],
      "catalog_code": "5C"
    },
    {
      "id": "feature_6c",
      "kind": "catalog_feature",
      "at": [
        -6,
        2
      ],
      "catalog_code": "6C"
    },
    {
      "id": "feature_7c",
      "kind": "catalog_feature",
      "at": [
        -1,
        2
      ],
      "catalog_code": "7C"
    },
    {
      "id": "feature_8c",
      "kind": "catalog_feature",
      "at": [
        -16,
        6
      ],
      "catalog_code": "8C"
    },
    {
      "id": "feature_1d",
      "kind": "catalog_feature",
      "at": [
        -11,
        6
      ],
      "catalog_code": "1D"
    },
    {
      "id": "feature_2d",
      "kind": "catalog_feature",
      "at": [
        -6,
        6
      ],
      "catalog_code": "2D"
    },
    {
      "id": "feature_3d",
      "kind": "catalog_feature",
      "at": [
        -1,
        6
      ],
      "catalog_code": "3D"
    },
    {
      "id": "feature_4d",
      "kind": "catalog_feature",
      "at": [
        -16,
        10
      ],
      "catalog_code": "4D"
    },
    {
      "id": "feature_5d",
      "kind": "catalog_feature",
      "at": [
        -11,
        10
      ],
      "catalog_code": "5D"
    },
    {
      "id": "feature_6d",
      "kind": "catalog_feature",
      "at": [
        -6,
        10
      ],
      "catalog_code": "6D"
    },
    {
      "id": "feature_1f",
      "kind": "catalog_feature",
      "catalog_code": "1F",
      "at": [
        -11,
        -21
      ]
    },
    {
      "id": "feature_2f",
      "kind": "catalog_feature",
      "catalog_code": "2F",
      "at": [
        4,
        -21
      ]
    },
    {
      "id": "feature_3f",
      "kind": "catalog_feature",
      "catalog_code": "3F",
      "at": [
        -11,
        -34
      ]
    },
    {
      "id": "feature_4f",
      "kind": "catalog_feature",
      "catalog_code": "4F",
      "at": [
        4,
        -34
      ]
    },
    {
      "id": "feature_1g",
      "kind": "catalog_feature",
      "catalog_code": "1G",
      "at": [
        15,
        -34
      ]
    },
    {
      "id": "feature_2g",
      "kind": "catalog_feature",
      "catalog_code": "2G",
      "at": [
        -2,
        -13
      ]
    },
    {
      "id": "feature_3g",
      "kind": "catalog_feature",
      "catalog_code": "3G",
      "at": [
        -17,
        -12
      ]
    },
    {
      "id": "feature_4g",
      "kind": "catalog_feature",
      "catalog_code": "4G",
      "at": [
        -12,
        -12
      ]
    },
    {
      "id": "feature_5a",
      "kind": "catalog_feature",
      "catalog_code": "5A",
      "at": [
        -25,
        -8
      ],
      "scale": 1,
      "rotation": 0
    },
    {
      "id": "feature_9c",
      "kind": "catalog_feature",
      "catalog_code": "9C",
      "at": [
        -30,
        -8
      ],
      "scale": 1,
      "rotation": 0
    },
    {
      "id": "feature_10c",
      "kind": "catalog_feature",
      "catalog_code": "10C",
      "at": [
        -25,
        0
      ],
      "scale": 1,
      "rotation": 0
    },
    {
      "id": "feature_7d",
      "kind": "catalog_feature",
      "catalog_code": "7D",
      "at": [
        -30,
        0
      ],
      "scale": 1,
      "rotation": 0
    },
    {
      "id": "feature_5f",
      "kind": "catalog_feature",
      "catalog_code": "5F",
      "at": [
        -28,
        -22
      ],
      "scale": 1,
      "rotation": 0
    }
  ],
  "npcs": [],
  "interactions": [
    {
      "id": "catalog_sign",
      "kind": "sign",
      "at": [
        15,
        4
      ],
      "title": "Menagery catalog",
      "lines": [
        "A Trees / B Rocks / C Wilderness / D Paths / E Creatures",
        "Press M or click Menagery catalog to browse and spawn. Specimens are practice only."
      ]
    },
    {
      "id": "terrain_sign",
      "kind": "sign",
      "at": [
        0,
        -15
      ],
      "title": "Terrain and cave catalog",
      "lines": [
        "F: hills and bluffs. G: cave features.",
        "Walk up the green ramps; stone cliff faces block movement.",
        "E at the northern 1G rock mouth enters the cave demo."
      ]
    }
  ],
  "enemies": [],
  "exits": [
    {
      "id": "east_coast",
      "rect": [
        18.7,
        -1.5,
        1,
        3
      ],
      "target": "coastal_path",
      "spawn": [
        -9.8,
        3
      ],
      "label": "Coastal Path"
    },
    {
      "id": "north_village",
      "rect": [
        14.7,
        -13.7,
        3,
        1
      ],
      "target": "village_green",
      "spawn": [
        -9.1,
        0
      ],
      "label": "Village Green"
    },
    {
      "id": "cave_door",
      "rect": [
        13.8,
        -34.4,
        2.4,
        1.2
      ],
      "target": "menagery_cave",
      "spawn": [
        0,
        5.5
      ],
      "label": "1G Cave demo",
      "interact": true
    }
  ]
}
